{
  "$schema": "https://json-schema.org/draft/2020-12/schema",
  "title": "ObservabilityTrace",
  "type": "object",
  "required": [
    "trace_id",
    "timestamp",
    "task_id",
    "repository",
    "agent_role",
    "operation",
    "prompt_id",
    "prompt_version",
    "context_package",
    "input_summary",
    "output_summary",
    "related_prs",
    "related_findings",
    "related_evaluations",
    "metadata"
  ],
  "properties": {
    "trace_id": { "type": "string" },
    "timestamp": { "type": "string" },
    "task_id": { "type": "string" },
    "repository": { "type": "string" },
    "agent_role": { "type": "string" },
    "operation": { "type": "string" },
    "prompt_id": { "type": "string" },
    "prompt_version": { "type": "string" },
    "context_package": { "type": ["string", "null"] },
    "input_summary": { "type": "string" },
    "output_summary": { "type": "string" },
    "related_prs": { "type": "array", "items": { "type": "integer" } },
    "related_findings": { "type": "array", "items": { "type": "string" } },
    "related_evaluations": { "type": "array", "items": { "type": "string" } },
    "metadata": { "type": "object" }
  },
  "additionalProperties": true
}
