{
  "trace_id": "sample-trace-01",
  "timestamp": "2026-01-01T00:00:00.000Z",
  "task_id": "MC-100",
  "repository": "repo-a",
  "agent_role": "coder",
  "operation": "record-context-package",
  "prompt_id": "coder-agent-v1",
  "prompt_version": "1.0.0",
  "context_package": "generated-context",
  "input_summary": "deterministic input",
  "output_summary": "context created",
  "related_prs": [101],
  "related_findings": [],
  "related_evaluations": ["eval-1"],
  "metadata": {
    "profile": "coder",
    "repositories": ["repo-a"],
    "tasks": ["MC-100"],
    "dependencies": []
  }
}
